BNS Section,Description,Punishment,Bailable/Non-Bailable,Cognizable/Non-Cognizable,Category
138,"Abduction refers to forcibly or deceitfully taking away any person. Unlike kidnapping, it is not limited to minors or guardianship, but rather the method of taking.","Punishment varies depending on the intent—abduction itself may be punished with imprisonment up to 7 years, but if committed with criminal intent (e.g., murder or ransom), the punishment increases accordingly.","Bailability depends on the intent; if it is plain abduction, it may be bailable, but with criminal purpose, it becomes non-bailable.","Cognizable if committed with intent to commit a serious offence (like ransom or murder), otherwise non-cognizable in isolation.",Offences Against the Person
139,Taking a child to use for begging or intentionally causing injury to exploit them for begging is a heinous crime under this clause.,"Punishable with imprisonment ranging from 10 years to life imprisonment, reflecting the gravity of exploiting children for personal gain.",Non-bailable due to the cruelty and long-term harm inflicted on the child; courts consider the act inhuman and exploitative.,"Cognizable, as immediate police intervention is necessary to rescue the child and prevent continued abuse.",Offences Against Child / Organized Crime
140,"This clause addresses kidnapping or abduction committed with intent to murder, demand ransom, or commit grievous harm. It is one of the most serious forms of abduction.","Punishable with life imprisonment or death, especially in cases of ransom or murder, indicating the highest level of severity in criminal law.","Non-bailable because such acts are considered direct threats to life and public safety, and release on bail may endanger others.",Cognizable since prompt police action is necessary to prevent harm or secure the release of hostages or abductees.,Heinous Crimes / Offences Against Person
141,"Bringing a minor (under 18) into India from another country for illicit purposes such as prostitution, child marriage, or slavery is criminalized under this clause.","Punishable with imprisonment up to 10 years and fine, recognizing the cross-border nature of child trafficking.",Non-bailable because it involves human trafficking and transnational crime with exploitation of vulnerable minors.,"Cognizable since trafficking crimes require urgent investigation and victim protection, allowing police to act immediately.",Human Trafficking / Offences Against Child
142,"This clause criminalizes the act of knowingly hiding or confining a person who has been kidnapped or abducted. Even if the person didn’t commit the original kidnapping, concealing the victim is treated as a serious offence.","Punishable with imprisonment up to 7 years and fine, as it aids and prolongs an illegal act and puts the victim in continued danger.",Non-bailable because it involves active participation in concealing a crime and obstructing justice; the accused must prove lack of intent to obtain bail.,"Cognizable since the concealed victim must be urgently rescued, allowing police to act without court permission.",Offences Against the Person
143,"This provision criminalizes recruiting, transporting, harboring, or receiving persons through coercion, force, fraud, or deception for exploitation. It covers human trafficking broadly, regardless of consent.","Punishable with rigorous imprisonment of not less than 7 years, which may extend to 10 years, and fine, reflecting the seriousness of exploitation.",Non-bailable due to the exploitative and organized nature of the crime; bail is rarely granted except in exceptional circumstances.,"Cognizable since it involves systemic abuse, and authorities must act immediately to stop the trafficking and rescue victims.",Human Trafficking / Organized Crime
144,"This clause penalizes anyone who exploits a trafficked person sexually, physically, or economically after trafficking has occurred. It includes knowingly using their services or harboring them for profit.","Punishable with imprisonment not less than 5 years and may extend to 10 years with fine, depending on the level and nature of exploitation.","Non-bailable as exploitation of trafficked persons is seen as part of organized crime, and the courts must first examine the severity before granting bail.","Cognizable since swift investigation and protection of the trafficked person is necessary, especially when abuse continues.",Human Trafficking / Sexual Offences
145,"This clause targets individuals who repeatedly engage in buying, selling, or trafficking human beings as slaves, indicating habitual conduct.","Punishable with life imprisonment or up to 10 years and fine, recognizing the long-term and repeated nature of human commodification.",Non-bailable because habitual offenders are deemed highly dangerous and are often part of organized trafficking networks.,Cognizable because such offences require immediate law enforcement action to dismantle trafficking chains and rescue victims.,Organized Crime / Human Trafficking
146,"This clause prohibits forcing someone to work against their will under threat, coercion, or without legal justification — covering bonded labour and forced servitude.","Punishable with imprisonment up to 1 year or with fine or both, depending on the extent of compulsion.","Bailable as this offence is considered comparatively less severe than kidnapping or trafficking, and usually investigated further before trial.",Cognizable since the state must intervene promptly when someone is being exploited in real-time through forced labour.,Forced Labour / Human Rights Offence
147,"This clause punishes any person who wages war or attempts to do so, or abets it, against the Government of India. Waging war refers to armed rebellion, insurgency, or any large-scale violent uprising.",Punishable with death or life imprisonment and fine due to the threat it poses to national sovereignty and public order.,Non-bailable because the offence strikes at the very core of national security; bail is denied to prevent further threats.,Cognizable since police and military must act immediately to prevent escalation or apprehend conspirators.,Offences Against the State
148,Covers conspiracy to wage war against the Government even if war has not actually begun. Mere planning can lead to liability.,"Punishable with life imprisonment or up to 10 years and fine, due to the serious intent to destabilize the state.",Non-bailable as conspirators may pose an ongoing risk; courts examine national interest before considering bail.,Cognizable as proactive intervention is necessary even at the planning stage to prevent national disruption.,Offences Against the State
149,"Deals with individuals who gather weapons, men, or supplies to wage war, even if they haven’t acted yet.",Punishable with life imprisonment or up to 10 years and fine because gathering arms is a preparatory step toward rebellion.,Non-bailable because accumulation of arms suggests imminent danger; preventive custody is often required.,Cognizable since quick police action can avert actual rebellion or armed confrontation.,Offences Against the State
150,"Punishes those who hide plans, information, or people to help others wage war against the government.","Punishable with up to 10 years imprisonment and fine, as concealment indirectly supports treasonous activity.","Non-bailable because the accused may have key information or links with larger networks, and bail could compromise national interest.",Cognizable as delayed investigation could let key players escape or destroy evidence.,Offences Against the State
151,"If someone assaults or uses force against high officials like the President or Governor to influence their lawful functions, it is a grave offence.","Punishable with up to 7 years imprisonment and fine, based on the dignity and authority of the constitutional office.",Non-bailable because it targets institutions of democracy; bail is denied until intent and risk are fully assessed.,Cognizable as immediate police action is necessary to protect high officials and the democratic process.,Offences Against the State / Public Servant
152,"Covers speech, writing, or actions that promote secession, rebellion, or undermine India’s unity or sovereignty.","Punishable with life imprisonment or up to 7 years and fine, depending on the gravity of act and reach of influence.","Non-bailable since these acts incite unrest or violence across states or communities, and release may trigger repeat acts.",Cognizable because police must immediately contain damage caused by anti-national elements.,Offences Against the State
153,This clause punishes Indians or anyone in India waging war against a friendly foreign government.,Punishable with life imprisonment or up to 7 years and fine to maintain international peace and treaty obligations.,"Non-bailable as it risks international relations and may involve arms, funding, or organized groups.",Cognizable since the government must act fast to avoid diplomatic incidents or prevent foreign retaliation.,Offences Affecting Foreign Relations
154,Refers to raiding or looting property in foreign countries that are friendly with India. Even private acts are criminalized.,"Punishable with imprisonment up to 7 years and fine, ensuring India doesn’t become a base for global lawlessness.",Non-bailable as such acts endanger diplomatic ties and create tension between nations.,Cognizable because swift intervention is needed to investigate foreign-linked activities and their funding.,Offences Affecting Foreign Relations
155,Those who accept or deal in property looted during unlawful acts covered in the previous two clauses are punishable.,Punishable with up to 7 years imprisonment and fine as they benefit from international crimes and perpetuate them.,"Bailable in some cases, especially if the accused proves lack of knowledge; otherwise non-bailable if proven complicit.",Cognizable because tracing such property involves fast action to recover stolen goods and cut funding sources.,Offences Affecting Foreign Relations
156,A government official who knowingly lets such a prisoner escape betrays public trust and state security.,Punishable with life imprisonment or up to 10 years and fine as it compromises law enforcement and public safety.,Non-bailable because the accused holds official power and might interfere with evidence or commit further misuse.,Cognizable as immediate arrest is necessary to prevent flight of national enemies or war criminals.,Offences by Public Servants
157,"In contrast to Clause 156, this addresses cases where escape happens due to carelessness rather than intent.",Punishable with imprisonment up to 3 years and fine because it still endangers security but lacks malice.,"Bailable since it results from negligence, not willful betrayal; bail is generally allowed with supervisory warning.","Cognizable because the consequences of escape can be severe, even if unintentional.",Offences by Public Servants
158,"This clause punishes civilians or other actors who help a state or war prisoner escape, hide them, or resist their capture.",Punishable with up to 10 years imprisonment and fine depending on level of involvement and success of the escape.,Non-bailable because helping a prisoner of war or a state prisoner is considered a threat to internal security.,Cognizable as quick apprehension is required to recover the prisoner and dismantle any supporting network.,Offences Against the State / Aiding Escape
159,"Encouraging or trying to persuade any member of the armed forces to disobey their duty, disloyalty, or rebellion is criminalized under this clause.",Punishable with life imprisonment or up to 10 years and fine due to the grave danger it poses to national security and discipline in the armed forces.,Non-bailable since the offence strikes at the discipline of military institutions and risks national safety.,Cognizable because the authorities must take immediate action to prevent unrest or coordinated mutiny.,Offences Relating to Armed Forces
160,"If mutiny actually occurs due to someone’s instigation, the offence becomes even more serious.",Punishable with death or life imprisonment and fine as it directly leads to loss of control in armed forces and threatens national defence.,"Non-bailable due to the involvement in the execution of mutiny, which is considered equivalent to armed rebellion.",Cognizable because swift detention is required to prevent spread of mutiny or involvement of other personnel.,Offences Relating to Armed Forces
161,"If anyone provokes or encourages an armed force member to assault their senior while the officer is performing duties, it falls under this clause.",Punishable with imprisonment up to 7 years and fine because it disrupts command and undermines military discipline.,Non-bailable as this offence disturbs the military hierarchy and discipline necessary for combat readiness.,"Cognizable since the act can escalate quickly into mutiny or insubordination, requiring immediate intervention.",Offences Relating to Armed Forces
162,"If the abetted assault actually occurs, the punishment becomes more severe under this clause.",Punishable with up to 10 years imprisonment and fine due to the actual breach of discipline and potential injuries involved.,"Non-bailable because the assault, once committed, represents a serious breakdown of order in the armed forces.",Cognizable as immediate police or military intervention is necessary to stop further harm and secure command.,Offences Relating to Armed Forces
163,This clause punishes anyone who encourages or helps a military person to illegally leave their post or service.,"Punishable with up to 2 years imprisonment and fine as it undermines troop strength and readiness, though not as serious as mutiny.",Bailable because the gravity is relatively less than mutiny or armed assault; courts may grant bail unless there's repeat offence.,"Cognizable as prompt action is needed to track and apprehend deserters, especially during active duty periods.",Offences Relating to Armed Forces
164,"If someone knowingly hides a soldier, sailor, or airman who has deserted, they are liable under this clause.","Punishable with up to 2 years imprisonment and fine, since harbouring allows the deserter to evade justice and disrupts military accountability.",Bailable as the offence does not involve direct participation in desertion but still obstructs justice.,Cognizable because early discovery of the deserter is necessary; harbouring may lead to more evasion or similar acts.,Offences Relating to Armed Forces
165,Holds ship captains accountable if a deserter boards their ship and they fail to report due to negligence.,"Punishable with fine, as this clause focuses on civil liability due to carelessness rather than criminal intention.","Bailable since the act arises from omission, not deliberate criminal aid, and bail is typically granted.",Non-cognizable because police action is initiated only after complaint or report; no immediate threat to public safety.,Offences Relating to Armed Forces
166,This clause penalizes civilians or others who encourage military members to disobey lawful orders of their superiors.,"Punishable with imprisonment up to 2 years and fine, as it endangers the chain of command in the defence system.",Bailable due to lower severity unless the insubordination leads to larger offence like mutiny or assault.,Cognizable since disrespect to authority can escalate into larger indiscipline; prompt action prevents loss of control.,Offences Relating to Armed Forces
167,"This clause ensures that those subject to military, naval or air force laws (such as under the Army/Navy/Air Force Act) are dealt with under special codes and not general penal law.",Not independently punishable under BNS; refers jurisdiction to special military law frameworks.,Bailability does not apply directly under BNS; governed by relevant military disciplinary code.,Cognizability also depends on military law; civil police typically hand over jurisdiction to defence authorities.,Jurisdiction Clause / Military Law
168,It is an offence to impersonate a member of the armed forces by wearing their uniform or insignia without permission.,"Punishable with imprisonment up to 3 months or fine or both, as it can be used to deceive or gain unauthorized access.","Bailable because the offence is minor and often associated with mischief, though serious if intent to impersonate is proven.",Non-cognizable as the offence generally does not pose immediate public threat unless linked with other crimes.,Military Impersonation / Public Order
169,"This section provides definitions of key terms such as “candidate” and “electoral right,” which serve as the foundation for interpreting subsequent offences.","Not punishable, as this is a definitional section that sets legal context, not a penal provision.","Not applicable, as there is no offence in this clause; it only aids interpretation of election-related offences.","Not applicable, as there is no complaint or criminal action arising directly from this section.",Election Law (Definitional)
170,Offering or accepting any gratification to induce someone to vote or refrain from voting is considered bribery under this clause.,"Punishable with imprisonment up to 1 year, or fine, or both. In the case of treating (giving food/drinks), only fine is imposed.","Bailable, as bribery in elections is a non-violent offence and courts generally allow bail for first-time political offenders.","Non-cognizable, because such matters usually require inquiry, evidence from Election Commission, and are not threats to immediate public safety.",Electoral Offences
171,"Intimidating, threatening, or using spiritual or social pressure to influence a voter's choice is considered undue influence.","Punishable with imprisonment up to 1 year, or fine, or both due to the impact on democratic integrity.",Bailable since offences under this clause are non-violent and often settled through investigation and fines.,Non-cognizable as police intervention is only initiated after preliminary inquiry or direction from election authorities.,Electoral Offences
172,Impersonating another voter or voting more than once is treated as a serious electoral fraud under this clause.,"Punishable with imprisonment up to 1 year, or fine, or both, because it directly corrupts the election process.","Bailable due to the possibility of mistaken identity in some cases, though courts scrutinize repeat offenders.",Non-cognizable because these cases are usually handled by the election machinery and require verification before FIR.,Electoral Offences
173,"Expands on Clause 170 by listing different types of bribery and classifying punishments accordingly, including where treating is involved.","Punishable with imprisonment up to 1 year, or fine, or both, aligning with the severity of the act.",Bailable because most election bribery offences are considered administrative misconduct unless accompanied by violence or coercion.,Non-cognizable as they require a complaint or report from election authorities to initiate proceedings.,Electoral Offences
174,"Combines penalties for both undue influence (Clause 171) and personation (Clause 172), reinforcing electoral transparency.","Punishable with imprisonment up to 1 year, or fine, or both, depending on the method and impact of influence or impersonation.","Bailable since offences often involve individual voter misconduct or party-level malpractices, not public threats.",Non-cognizable due to the need for verification and recommendation by an electoral officer before police action.,Electoral Offences
175,Making a knowingly false statement about a candidate’s personal character or conduct to influence election results is penalized under this clause.,"Punishable with imprisonment up to 6 months, or fine, or both, considering the reputational damage caused.","Bailable because it is a speech-related, non-violent offence and subject to the test of intent and truth.","Non-cognizable since it relates to defamation-style allegations, and requires judicial or EC inquiry before FIR.",Electoral Offences
176,Spending or giving money for election purposes without following legal limits or procedures is criminalized.,"Punishable with fine up to ₹10,000 or imprisonment up to 3 months in some cases, emphasizing campaign finance control.","Bailable since it is an economic regulatory offence, and usually resolved with penalties or disqualification proceedings.",Non-cognizable as these are treated as administrative or regulatory violations unless linked to larger corruption schemes.,Electoral Offences
177,"If a candidate fails to maintain proper election expenditure records as required by law, they are liable under this clause.","Punishable with fine up to ₹5,000, ensuring transparency in political financing without resorting to harsh imprisonment.","Bailable because it is a compliance failure, not a malicious act; bail is generally granted unless repeated.",Non-cognizable because police intervention is based on reports by election officers and not direct complaints.,Electoral Offences
178,"Counterfeiting or participating in the process of counterfeiting any coin, Government revenue stamp, currency-note, or bank-note. Includes altering genuine coins/stamps to appear as others of different denominations.","Imprisonment for life, or imprisonment up to 10 years, and fine",Non-Bailable,Cognizable,"Offences relating to coin, currency-notes, bank-notes, and government stamps"
179,"Using, selling, buying, importing/exporting, or trafficking in counterfeit coins, Government stamps, currency-notes, or bank-notes with knowledge or reason to believe they are counterfeit.","Imprisonment for life, or imprisonment up to 10 years, and fine",Non-Bailable,Cognizable,"Offences relating to coin, currency-notes, bank-notes, and government stamps"
180,"Possessing forged or counterfeit coin, stamp, currency-note, or bank-note with intent to use as genuine or cause it to be used as genuine, knowing or believing it to be counterfeit. Exception if obtained lawfully.","Imprisonment up to 7 years, or fine, or both",Bailable,Cognizable,"Offences relating to coin, currency-notes, bank-notes, and government stamps"
181,"Making, repairing, buying, selling, or possessing machinery, dies, tools, or materials for use in forging or counterfeiting coins, Government stamps, currency-notes, or bank-notes.","Imprisonment for life, or imprisonment up to 10 years, and fine",Non-Bailable,Cognizable,"Offences relating to coin, currency-notes, bank-notes, and government stamps"
182,Making or using any document that resembles a currency-note or bank-note in a deceptive manner. Also penalizes refusal to disclose information about the source of such documents.,Fine up to ₹300; refusal to disclose info punishable with fine up to ₹600,Bailable,Non-Cognizable,"Offences relating to coin, currency-notes, bank-notes, and government stamps"
183,"Fraudulently removing or erasing writing from a government-stamped document, or reusing stamps for a different document to cause loss to the Government.","Imprisonment up to 3 years, or fine, or both",Bailable,Non-Cognizable,"Offences relating to coin, currency-notes, bank-notes, and government stamps"
184,"Using a Government revenue stamp known to have been previously used, with fraudulent intent or intent to cause loss to the Government.","Imprisonment up to 2 years, or fine, or both",Bailable,Non-Cognizable,"Offences relating to coin, currency-notes, bank-notes, and government stamps"
185,"Erasing or removing usage marks from a Government stamp to reuse it, or possessing/selling such stamps knowing they have been used or altered.","Imprisonment up to 3 years, or fine, or both",Bailable,Non-Cognizable,"Offences relating to coin, currency-notes, bank-notes, and government stamps"
186,"Making, possessing, selling, or using any fictitious postage stamp or instruments for making such stamps. Punishable also for refusal to disclose source. “Fictitious stamp” refers to imitation of official postage stamps.",Fine up to ₹200,Bailable,Non-Cognizable,"Offences relating to coin, currency-notes, bank-notes, and government stamps"
187,Mint employee acts or omits duties with the intent to alter the weight or composition of coins from the legal standard.,"Imprisonment up to 7 years, and fine",Non-Bailable,Cognizable,"Offences relating to coin, currency-notes, bank-notes, and government stamps"
188,"Taking any coining tool or instrument out of a mint lawfully established in India, without lawful authority.","Imprisonment up to 7 years, and fine",Non-Bailable,Cognizable,"Offences relating to coin, currency-notes, bank-notes, and government stamps"
189(2),"Joining or continuing in an unlawful assembly, knowing the facts that make it unlawful.","Up to 6 months imprisonment, or fine, or both",Bailable,Cognizable,Offences against public tranquility
189(3),Joining or remaining in unlawful assembly after lawful command to disperse.,"Up to 2 years imprisonment, or fine, or both",Bailable,Cognizable,Offences against public tranquility
189(4),Being armed with a deadly weapon while being a member of an unlawful assembly.,"Up to 2 years imprisonment, or fine, or both",Bailable,Cognizable,Offences against public tranquility
189(5),"Knowingly joining an assembly likely to disturb public peace, after lawful dispersal command.","Up to 6 months imprisonment, or fine, or both",Bailable,Cognizable,Offences against public tranquility
189(6),"Hiring, engaging, promoting or conniving at engaging someone to join an unlawful assembly.",Same punishment as the hired member and for offences committed by them,Non-Bailable,Cognizable,Offences against public tranquility
