BNS Section,Description,Punishment,Bailable/Non-Bailable,Cognizable/Non-Cognizable,Category
14,"A person acting under a lawful duty, or under a mistake of fact thinking he is bound by law, is not criminally liable.",Not punishable because there is no criminal intent; the person is either legally obligated or honestly mistaken about a duty.,"Bailability does not arise unless the court rejects the exception; if rejected, underlying offence determines bailability.",Cognizable only if the act is found unlawful and the exception is denied during investigation.,General Exception
15,A judge acting within legal jurisdiction and in good faith is immune from criminal prosecution.,"Not punishable because judges are protected to ensure independent judicial function, unless malice is proven.",Bailability is not relevant because judges cannot be arrested for acts done judicially unless permitted by higher authority.,Not cognizable as criminal complaints against judicial acts require sanction or appeal to a superior court.,General Exception
16,"A person acting under a court order, even if the order is later invalidated, is not criminally liable.","Not punishable because the executor is acting under presumed lawful authority, and liability lies with the issuing court.",Bailability is irrelevant unless the act exceeds the scope of the court order; then the base offence determines bailability.,Not cognizable if action stays within court’s instructions; cognizable only if clearly unlawful or exceeds the mandate.,General Exception
17,"If a person acts in good faith believing the law justifies their act (due to mistake of fact), they are not liable.",Not punishable if belief is honest and based on mistake of fact; punishment applies only if mistake is of law.,"Bail depends on whether the exception is upheld; if rejected, the base offence governs bailability.",Cognizable only if the justification fails and the underlying act itself constitutes an offence.,General Exception
18,Harm caused accidentally during a lawful act done with due care is not punishable.,Not punishable as there is no intent or negligence; law exempts accidental harm occurring during lawful activity.,"Bailability applies only if negligence or recklessness is later established, in which case the person may be tried.",Not cognizable unless police find prima facie evidence of criminal negligence behind the act.,General Exception
19,"An act done without criminal intent to prevent greater harm (e.g., breaking a door to save a life) is not an offence.",Not punishable because the law prioritizes prevention of more serious harm over technical wrongdoing.,"Bailability is relevant only if court finds the act excessive or disproportional; otherwise, not applicable.",Cognizable only if the preventive act becomes disproportionate or malicious and the exception fails.,General Exception
20,"Children below 7 are legally incapable of forming criminal intent (doli incapax), hence not liable.",Not punishable because children of this age lack the mental maturity to understand the nature of the act.,Bailability does not apply as the child cannot be arrested or prosecuted; they are instead referred for counselling or supervision.,Not cognizable because police cannot file a criminal case against a child under 7 under any condition.,General Exception
21,Children between 7 and 12 are exempt if the court believes they lacked maturity to understand the offence.,Not punishable if the child is found incapable of understanding the consequences of their act.,"If found mature, the case proceeds and bail is determined by the base offence; if not, child is released to guardianship.",Cognizable only if sufficient maturity and intent are shown; otherwise handled by Juvenile Justice Board.,General Exception
22,A person unable to know the nature or wrongness of their act due to mental illness is exempt from liability.,"Not punishable because intent (mens rea) is absent and such individuals may need psychiatric care, not prison.",Bailability is usually not needed as court orders medical observation or treatment instead of custody.,"Not cognizable unless mental health evaluation proves sanity; until then, medical intervention replaces criminal process.",General Exception
23,"Involuntary intoxication (e.g., drugged unknowingly) nullifies responsibility if the person was incapable of judgment.",Not punishable if the intoxication is proven to be against the person’s will and they lacked understanding of their act.,Bail is not required unless act was serious; the court may order medical testing to confirm intoxication status.,Cognizable if injury or serious consequence occurs; otherwise handled cautiously during investigation.,General Exception
24,A voluntarily intoxicated person is not exempt unless the offence requires specific intent or knowledge that the person was incapable of forming.,Punishable if intent or knowledge can be proven despite intoxication; intoxication does not provide blanket immunity.,Bailability depends on the severity of the offence committed while intoxicated; it does not automatically affect bail status.,"Cognizable or non-cognizable is decided based on the nature of the offence committed under intoxication, not the intoxication itself.",General Exception
25,"If a person, with consent, performs an act without intention or knowledge that it may cause death or grievous hurt, they are not liable. This recognizes individual autonomy and absence of criminal intent.","Not punishable because the act was consensual, done without criminal intent or foreseeable risk of severe harm.","Bailability becomes relevant only if the consent is later disputed; otherwise, arrest is not required.",Cognizability arises only if injury caused is serious and consent is deemed invalid by court.,General Exception
26,"Covers acts done for someone's benefit (e.g. surgery) with that person’s consent, and no intent to cause death.","Not punishable because the act is in good faith and intended to help, not harm.",Bailability and arrest do not apply unless consent was invalid or act was grossly negligent.,Not cognizable unless the act was reckless or consent was fraudulently obtained.,General Exception
27,"Actions taken with guardian consent in the best interest of those unable to consent themselves (e.g., mentally ill or children) are exempt.","Not punishable because of absence of intent and presence of lawful, good-faith consent.",Bailability applies only if there is evidence of abuse or negligence; otherwise not required.,Cognizable if the act results in disproportionate harm or violates medical/legal procedures.,General Exception
28,"Consent is invalid if obtained through coercion or misunderstanding. In such cases, the act remains an offence.",Punishable because the law does not accept consent obtained under threat or deception as real consent.,"Bailability depends on the underlying act; if consent is proven invalid, normal penal consequences follow.",Cognizable if the offence committed is serious and consent is proven to be improperly obtained.,General Exception
29,"Certain acts are considered crimes regardless of whether they result in actual harm. For example, assault or attempt to commit a crime.","Punishable because the law criminalizes the act itself, not just its consequence.","Bailability and cognizability depend on the specific offence, as the clause refers to the principle of “act being inherently criminal.”",Cognizable if the nature of act makes it criminal even without harm — such as attempt to murder.,General Exception
30,"If someone cannot give consent (due to unconsciousness, accident, etc.), and another acts in good faith to help, they are not liable.","Not punishable because it is unreasonable to expect consent when urgent help is needed, and the act is done with good intent.",Bail or arrest is not needed unless harm results and good faith is disputed in court.,"Not cognizable unless the act turns out to be negligent, or is clearly unjustified.",General Exception
31,"Honest communication made in good faith, even if it causes offence or emotional harm, is not criminal. This protects whistleblowers, advisors, or medical professionals giving difficult advice.",Not punishable as long as there’s no malice or intent to harm; good faith is a valid defence.,"Bailability and arrest are not applicable unless the communication violates another specific law (e.g., defamation with malice).","Not cognizable unless accompanied by falsehood, threat, or incitement leading to criminal harm.",General Exception
32,An act committed under coercion or unlawful threat (except murder or certain grave offences) is excused.,Not punishable if it is proven that the person acted under threat that overpowered their free will.,Bail may be granted while investigating if coercion claim is valid; the person is treated as a victim of force.,"Cognizable if the compelled act is serious, but the coercer becomes the primary accused.",General Exception
33,Acts that cause trivial or minimal harm without criminal intent are excused under this clause.,Not punishable because the law disregards negligible harm unless repeated or deliberate.,Bail is not applicable as criminal action itself is not initiated unless the act is shown to be habitual or done with malice.,Not cognizable because police do not register FIRs or make arrests for trifling injuries or irritations.,General Exception
45,"Instigation, conspiracy, or intentional aid to commit an offence.",Same as the offence abetted. Example: abetting theft results in up to 3 years imprisonment and fine.,"Depends on act abetted. Theft is bailable, murder is non-bailable.","Depends on act abetted. Theft is cognizable, cheating is non-cognizable.",Abetment
46,A person who abets an offence is called an abettor.,Same as the offence committed. Example: abettor of rape receives the punishment for rape.,"Follows the classification of the main offence. Rape is non-bailable, theft is bailable.","Follows the classification of the main offence. Rape is cognizable, defamation is non-cognizable.",Abetment
47,"If the act done abroad would be a crime in India, the abettor is punished under Indian law.",Treated as committed in India. Example: abetting bribery abroad is punished under Indian anti-corruption laws.,Based on the equivalent offence under Indian law. Corruption is non-bailable.,Based on the equivalent offence under Indian law. Corruption is cognizable.,Abetment
48,"The offence is committed in India, and the abettor acts from abroad.",Treated as if committed in India. Example: abetting cybercrime in India from abroad attracts punishment under the IT Act.,"Depends on the offence. Cyberterror is non-bailable, identity theft is bailable.","Depends on the offence. Cyberterror is cognizable, email spoofing is non-cognizable.",Abetment
49,When the act is committed due to abetment but has no separate punishment clause.,Same as the offence committed. Example: abetting breach of contract carries the same punishment as breach of contract.,Based on the offence committed. Breach of contract is generally bailable.,Based on the offence committed. Usually non-cognizable unless severe.,Abetment
50,Person does the act with intent different from that of the abettor.,"Based on the abettor's intent. Example: abettor plans robbery, doer believes it’s a prank — robbery laws still apply.",Robbery is non-bailable.,Robbery is cognizable.,Abetment
51,"A different act is committed than the one abetted, but it is a probable consequence.","Same as the actual offence. Example: abetting theft, but murder happens — abettor is punished for murder.",Murder is non-bailable.,Murder is cognizable.,Abetment
52,Both the act abetted and the act done are punishable.,Punishment for both acts. Example: abetting cheating and forgery results in punishment for both.,"Cheating is bailable, forgery is non-bailable.","Cheating is non-cognizable, forgery is cognizable.",Abetment
53,"A different result occurs from what was intended, but it was foreseeable.",Punishment for the actual effect. Example: abetting a fight that leads to death — abettor is punished for homicide.,Homicide is non-bailable.,Homicide is cognizable.,Abetment
54,"If the abettor is present when the offence is committed, they are treated as the main offender.",Same as the main offence. Example: present during robbery means punishment as for robbery (10 years + fine).,Robbery is non-bailable.,Robbery is cognizable.,Abetment
55,"Abetting an offence punishable with death or life imprisonment, if not committed.",Up to 7 years + fine. Example: abetting planned murder that doesn't happen.,Non-bailable,Cognizable,Abetment
56,Abetting any offence punishable with imprisonment (not death/life) that is not committed.,Up to one-fourth of the longest term provided for the offence. Example: abetting theft which doesn't occur = up to 9 months.,Bailable (generally),Non-cognizable (generally),Abetment
57,Instigating a mob (more than 10 people) to commit an offence.,Same as abetted offence. Example: abetting mob violence = full punishment for mob crime.,Non-bailable (typically),Cognizable,Abetment
58,Intentionally hiding plans to commit serious offences.,Up to 7 years + fine. Example: hiding a plan for terror attack.,Non-bailable,Cognizable,Concealment
59,A public servant knowingly fails to prevent a serious offence.,Up to 7 years + fine. Example: a police officer ignores a murder plot.,Non-bailable,Cognizable,Concealment by Public Servant
60,Hiding the plan to commit an imprisonable offence (less than life/death).,Up to 3 years + fine. Example: not informing police about a planned robbery.,Bailable,Non-cognizable,Concealment
61,Agreement between two or more persons to commit an illegal act.,"Same as offence conspired. If no act is done, up to 6 months + fine. Example: conspiracy to murder = murder punishment.",Non-bailable if serious. Otherwise bailable.,Cognizable if offence conspired is cognizable.,Conspiracy
62,Attempting to commit any offence punishable with life or imprisonment.,Punishment up to half the term of the offence. Example: attempt to murder = up to 10 years.,Non-bailable (if serious),Cognizable,Attempt
63,"Non-consensual sexual intercourse under defined circumstances, including threat, coercion, or incapacity.","Imprisonment of not less than 10 years, may extend to life, + fine.",Non-bailable,Cognizable,Sexual Offence
64,General punishment clause for rape.,Rigorous imprisonment for 10 years to life + fine.,Non-bailable,Cognizable,Sexual Offence
65,"Rape of minor (under 16), pregnant woman, or by persons in authority.",Minimum 20 years to life or death in extreme cases.,Non-bailable,Cognizable,Sexual Offence
66,When rape results in victim’s death or permanent vegetative state.,Life imprisonment or death.,Non-bailable,Cognizable,Sexual Offence
67,Forced intercourse by husband during judicial separation.,Imprisonment up to 2 years + fine.,Bailable,Cognizable,Sexual Offence (Marital)
68,Abuse of official/educational/superior authority to force intercourse.,5 to 10 years + fine.,Non-bailable,Cognizable,Sexual Offence
69,"Obtaining intercourse through false identity, false promises of marriage, job, etc.",10 years to life + fine.,Non-bailable,Cognizable,Sexual Offence
70,Rape committed by two or more persons acting together.,"Life imprisonment for each offender, minimum 20 years, or death.",Non-bailable,Cognizable,Sexual Offence
71,Repeat offence of rape under Clause 64 or 65.,Imprisonment for life or death.,Non-bailable,Cognizable,Sexual Offence
72,Printing or publishing the identity of rape victim without consent or court order.,Up to 2 years + fine.,Bailable,Cognizable,Procedural Offence
73,Publication of court proceedings related to sexual offences without prior approval.,Up to 2 years + fine.,Bailable,Cognizable,Procedural Offence
74,Any physical act intending to insult or outrage the modesty of a woman.,Up to 3 years + fine.,Bailable,Cognizable,Assault on Woman
75,"Unwelcome physical contact, advances, or sexually colored remarks.",Up to 3 years + fine for physical contact; up to 1 year + fine for verbal/gestural acts.,Bailable,Cognizable,Sexual Harassment
76,Intentional use of force to disrobe or compel disrobing of a woman.,"Not less than 3 years, may extend to 7 years + fine.",Non-bailable,Cognizable,Sexual Assault
77,Watching or capturing the image of a woman engaging in private acts without her consent.,First offence: 1 to 3 years + fine; Second offence: 3 to 7 years + fine.,"First offence: Bailable, Second: Non-bailable",Cognizable,Privacy Offence
78,Following a woman or contacting her repeatedly despite disinterest.,First offence: Up to 3 years + fine; Repeat offence: Up to 5 years + fine.,"First offence: Bailable, Second: Non-bailable",Cognizable,Harassment
79,"Speaking, gesturing, or acting in a way intended to insult a woman’s modesty.",Up to 3 years + fine.,Bailable,Cognizable,Verbal Assault
80,"Death of a woman caused by burns, injuries, or unnatural circumstances within 7 years of marriage and linked to dowry harassment.","Not less than 7 years, may extend to life imprisonment.",Non-bailable,Cognizable,Dowry / Marriage Offence
81,A man causes a woman to cohabit or have sexual relations by making her believe they are lawfully married.,Up to 10 years + fine.,Non-bailable,Cognizable,Marriage Fraud
82,Bigamy – marrying another person while the first spouse is still alive and marriage not legally dissolved.,Up to 7 years + fine.,Bailable,Non-cognizable,Bigamy
83,Performing a marriage ceremony without intention or legal authority to marry.,Up to 7 years + fine.,Bailable,Non-cognizable,Marriage Fraud
84,Taking or keeping a married woman away from her husband with criminal intent.,Up to 2 years + fine.,Bailable,Non-cognizable,Abduction / Enticement
85,Any physical or mental cruelty inflicted by husband or his relatives.,Up to 3 years + fine.,Non-bailable,Cognizable (upon complaint by victim or her relative),Domestic Violence
87,Forcefully taking or inducing a woman to marry someone or be forced into illicit relations.,Up to 10 years + fine.,Non-bailable,Cognizable,Kidnapping / Forced Marriage
88,Intentionally causing a woman to miscarry without lawful justification (not in good faith to save her life).,Up to 3 years + fine if woman not quick with child; up to 7 years if quick with child.,Bailable,Non-cognizable,Miscarriage
89,Forcing a woman to miscarry without her consent.,Up to 10 years + fine.,Non-bailable,Cognizable,Forced Miscarriage
90,"Woman dies due to act intended to cause miscarriage, whether with or without consent.",Up to 10 years if with consent; life imprisonment if without consent.,Non-bailable,Cognizable,Miscarriage Resulting in Death
91,Any act intended to stop a child from being born alive or to cause its death after birth.,Up to 10 years + fine.,Non-bailable,Cognizable,Prenatal Homicide
92,Death of a viable unborn child caused by an act that would amount to culpable homicide if committed against a person.,Up to 10 years + fine.,Non-bailable,Cognizable,Foetal Homicide
93,"A parent or guardian abandons or exposes a child under 12 years, endangering its life.",Up to 7 years + fine.,Bailable,Cognizable,Child Endangerment
94,"Secretly disposing of a dead child’s body to conceal birth, regardless of whether the child was born alive.",Up to 2 years + fine or both.,Bailable,Non-cognizable,Concealment
95,Employing or using a child to commit any illegal act.,Same punishment as for the offence committed.,Follows underlying offence (serious ones = non-bailable).,Cognizable,Child Exploitation
96,"Bringing or enticing a child for purposes like prostitution, illicit intercourse, slavery, etc.",Up to 10 years + fine.,Non-bailable,Cognizable,Child Trafficking
97,Taking a child under 10 with the intent to steal jewelry or belongings.,Up to 7 years + fine.,Non-bailable,Cognizable,Child Kidnapping
98,"Selling or disposing of a child for purposes of prostitution, sexual abuse, or other immoral acts.",Up to life imprisonment + fine.,Non-bailable,Cognizable,Child Trafficking
99,Buying or obtaining possession of a child for immoral purposes like prostitution or slavery.,Up to life imprisonment + fine.,Non-bailable,Cognizable,Child Trafficking
100,"Causing death with intent or knowledge, not amounting to murder.",Up to life imprisonment or 10 years + fine.,Non-bailable,Cognizable,Homicide
101,"Causing death with intent and knowledge, falling under full definition of murder.",Death or life imprisonment + fine.,Non-bailable,Cognizable,Murder
102,Death caused to someone other than the intended victim.,Punishment as if intended person was killed.,Non-bailable,Cognizable,Homicide
103,General punishment clause for murder.,Death or life imprisonment + fine.,Non-bailable,Cognizable,Murder
104,Life convict commits murder during sentence.,Death or life imprisonment.,Non-bailable,Cognizable,Murder
105,Where intention is present but circumstances reduce gravity.,Up to 10 years or life imprisonment + fine.,Non-bailable,Cognizable,Homicide
106,Negligent act not amounting to culpable homicide (e.g. rash driving).,Up to 5 years + fine; 10 years if death of multiple persons.,Bailable,Cognizable,Negligent Homicide
107,Assisting suicide of child (<18) or person of unsound mind.,Minimum 10 years to life imprisonment + fine.,Non-bailable,Cognizable,Abetment of Suicide
108,Instigating or aiding someone to commit suicide.,Up to 10 years + fine.,Non-bailable,Cognizable,Abetment of Suicide
109,Attempting to cause death with intent.,Up to 10 years + fine; life if injury caused.,Non-bailable,Cognizable,Attempt to Murder
110,"Attempt with knowledge or intent, but without causing death.",Up to 7 years + fine.,Non-bailable,Cognizable, Attempt to Homicide
111,"Crime committed by a group or network for economic gain, coercion, violence, or intimidation (e.g., extortion rackets, contract killings, trafficking).",Death or life imprisonment and fine of ₹10 lakh.,Non-bailable,Cognizable,Organised Crime
112,"Lower-level but repeated or coordinated criminal acts (e.g., pickpocketing rings, chain snatching, local extortion gangs).",1 to 7 years + fine.,Non-bailable,Cognizable,Petty Organised Crime
113,"Acts intended to threaten unity, integrity, security, or sovereignty of India, or to strike terror in the public.",Death or life imprisonment + fine.,Non-bailable,Cognizable,Terrorism
115,Intentionally causing hurt to another.,"Up to 1 year or fine up to ₹10,000 or both.",Bailable,Non-cognizable,Hurt
117,Intentionally causing grievous hurt.,Up to 7 years + fine.,Bailable,Cognizable,Grievous Hurt
118,"Causing hurt using fire, acid, poison, or deadly weapons.",3 to 10 years + fine depending on severity.,Non-bailable,Cognizable,Aggravated Hurt
119,Hurting someone to extort money/property or force an illegal act.,10 years to life + fine.,Non-bailable,Cognizable,Extortion via Hurt
120,Causing hurt to force confession or recover property.,Up to 10 years + fine.,Non-bailable,Cognizable,Torture for Confession
121,Injuring a public servant to prevent performance of duty.,Up to 10 years + fine.,Non-bailable,Cognizable,Obstruction of Duty
122,Committing hurt in response to grave and sudden provocation.,Up to 3 years + fine.,Bailable,Cognizable,Provoked Hurt
123,Administering poison or similar substance to cause hurt or facilitate a crime.,Up to 10 years + fine.,Non-bailable,Cognizable,Poisoning
124,Intentionally throwing or using acid/chemical to disfigure or harm.,Minimum 10 years to life + fine (paid to victim).,Non-bailable,Cognizable,Acid Attack
126,Illegally obstructing a person so they cannot proceed in a direction they have a right to go.,"Up to 1 month or ₹1,000 fine or both.",Bailable,Non-cognizable,Wrongful Restraint
127,Wrongfully restraining someone in a way that prevents them from proceeding beyond certain limits (i.e. imprisonment without legal authority).,"Up to 1 year or ₹5,000 fine or both.",Bailable,Cognizable,Wrongful Confinement
131,General punishment for unlawful force or assault without serious provocation.,"Up to 3 months or ₹1,000 fine or both.",Bailable,Non-cognizable,Assault / Criminal Force
132,Preventing or threatening a public servant from performing official duties.,Up to 2 years or fine or both.,Bailable,Cognizable,Obstruction of Duty
133,Intentionally using force or assault to insult or shame someone.,Up to 2 years or fine or both.,Bailable,Cognizable,Assault to Insult
134,Attempting theft by using or threatening force against someone carrying property.,Up to 2 years + fine.,Bailable,Cognizable,Robbery Attempt
135,Using force to trap or confine someone unlawfully.,Up to 1 year + fine.,Bailable,Cognizable,Wrongful Confinement
136,Causing assault or using force under sudden and grave provocation.,"Up to 1 month or ₹1,000 fine or both.",Bailable,Non-cognizable,Provoked Assault
137,This clause criminalizes the act of taking or enticing away any child or person out of lawful guardianship without the guardian’s consent. It also includes kidnapping from India or from lawful custody.,"Punishable with imprisonment up to 7 years and fine, as it involves removing a person from legal protection.","Non-bailable, because kidnapping poses a serious threat to the victim’s freedom and safety, and bail is granted only after judicial scrutiny.","Cognizable, since police can register a case and arrest without a warrant due to the urgent need to trace the missing person.",Offences Against the Person
